{
  "schemaVersion": 3,
  "runId": "logit-lens-implicit-fbb4-codex",
  "reconstructed": true,
  "updated_at": "2026-07-22T13:53:29.905366+00:00",
  "narrative": "This run tested whether a logit-lens-style decoder can map intermediate Qwen2.5-0.5B hidden states to implicit vocabulary items — whole multi-token English word types absent from the explicit tokenizer. A 128-entry implicit vocabulary was built from WikiText-2, arranged into 16 final-subtoken groups of 8 words each to control for suffix leakage, and a layer-local prototype table (ITL) was evaluated against five baselines on 512 held-out test examples. The ITL at validation-selected layer 5 reached 19.53% test top-1 accuracy, significantly outperforming the final-subtoken majority ceiling of 12.50% and the mean-subtoken embedding baseline of 10.94%. A Tuned-Lens-style ridge translator to final-layer prototypes failed badly at this data scale, reaching only 3.71% test top-1, confirming that layer-local prototype tables — not a universal translated output space — are the viable method in this setting. The layer-wise pattern, with whole-word ITL peaking at layer 5 while suffix-token identity peaks at layer 0, is qualitatively consistent with the token-erasure account of implicit vocabulary formation, though causal validation and unsupervised discovery remain open.",
  "current_best": "Layer-local ITL at validation-selected layer 5: test top-1 19.53%, test top-5 25.59%, test MRR 0.240; beats final-subtoken majority by 7.03 pp (CI [2.53, 11.72], p=0.0045) and raw final-prototype baseline by 5.47 pp (CI [2.15, 8.79], p=0.0023)",
  "headline": "A layer-local implicit-token lens recovers held-out multi-token word identity at 19.53% test top-1 over 128 candidates, beating the final-subtoken majority ceiling (12.50%) by 7.03 pp (bootstrap 95% CI [2.53, 11.72], p=0.0045).",
  "keyFacts": [
    "128 candidate implicit vocabulary words from WikiText-2; 16 suffix groups × 8 words each (12.5% subtoken ceiling)",
    "Qwen2.5-0.5B; 896-dim hidden size; 25 hidden-state levels (embedding + 24 transformer layers)",
    "2048 total examples: 1280 train / 256 val / 512 test (10/2/4 per word)",
    "5 baselines: final-subtoken majority, majority-word chance, mean-subtoken embedding, raw final prototype, ridge-to-final ablation",
    "Full reproducibility verified: second cached rerun produced identical SHA-256 hashes for all primary output files",
    "Single NVIDIA RTX A6000 GPU; scope limited to one model, one English corpus, supervised vocabulary only"
  ],
  "methodology": [
    "Dataset: local WikiText-2 raw; candidates are lowercased alphabetic words tokenizing into ≥2 pieces with ≥16 corpus occurrences",
    "Leakage control: 16 balanced final-subtoken groups × 8 words each, capping trivial suffix ceiling at 12.5% top-1",
    "Hidden-state extraction: final-subtoken-position states at all 25 levels with final LayerNorm applied, stored as float16 NPZ; shape [2048, 25, 896]",
    "Primary ITL: per-layer cosine-similarity retrieval against L2-normalized training centroids; layer selected by validation top-1 accuracy",
    "Ablation: ridge-to-final-prototype translator (λ=10, unregularized bias) mapping each layer into fixed final-layer prototype space",
    "Statistics: 3000-sample bootstrap CIs, 6000-sample paired randomization tests, McNemar exact test, BH FDR correction for 25 layer-wise comparisons"
  ],
  "future_work": [
    "Mine candidate implicit items from token-erasure footprints and validate with Patchscopes — removing pre-specified word-type labels to move toward unsupervised discovery",
    "Scale to Qwen-7B and Llama-3 family models to test whether the layer-5 peak and suffix-group confound pattern hold with larger hidden dimensions",
    "Test causal validity: ablate or replace implicit-word prototype directions and measure effect on downstream prediction accuracy",
    "Extend vocabulary to named entities, multi-word phrases, and non-English text to assess generality beyond simple alphabetic English words",
    "Increase training occurrences per word (>10) and explore lower-rank or sketched affine translators to test whether the ridge failure is recoverable with more data",
    "Investigate why 'highland' is the dominant default wrong prediction across multiple suffix groups — a possible prototype geometry artifact worth localizing"
  ],
  "crux": "The vocabulary is supervised and fixed to known word types, so the experiment demonstrates decodability of a pre-specified set but cannot establish that the model internally organizes representations around implicit items beyond what a labelled prototype probe can exploit; errors concentrated within suffix groups and across topically related terms (ireland→lebanon, lowland→highland) leave residual orthographic and contextual confounds unresolved at this scale.",
  "cruxEvidence": [
    {
      "type": "finding",
      "id": "F13"
    },
    {
      "type": "decision",
      "id": "D6"
    }
  ],
  "hypotheses": [
    {
      "id": "H1",
      "statement": "Multi-token word occurrences cluster by whole-word identity in final-layer hidden-state space strongly enough to define reusable implicit-token prototypes.",
      "status": "supported",
      "affects": [],
      "basedOn": [
        "planning.md"
      ],
      "evidence": [
        {
          "type": "artifact",
          "path": "results/additional_comparisons.json",
          "itemId": null,
          "note": "raw_final_layer22 accuracy 0.140625 (14.06%) with bootstrap CI [0.111328125, 0.171875], confirming final-layer prototype centroids retrieve held-out word identity well above 0.78% chance."
        },
        {
          "type": "artifact",
          "path": "results/summary.json",
          "itemId": null,
          "note": "candidate_vocab_stats: 128 words, 16 unique_final_subtokens, largest_final_subtoken_group=8; all_prototypes_finite=true in validation_checks confirming stable centroids."
        }
      ],
      "updated_at": "2026-06-29T05:08:57.883559",
      "type": "hypothesis",
      "ts": "2026-06-29T05:08:57.883559",
      "links": []
    },
    {
      "id": "H2",
      "statement": "Earlier-layer hidden states can be translated into the final-layer implicit-token prototype space with a simple affine/ridge map (Tuned-Lens-style implicit lens).",
      "status": "refuted",
      "affects": [],
      "basedOn": [
        "planning.md"
      ],
      "evidence": [
        {
          "type": "artifact",
          "path": "REPORT.md",
          "itemId": null,
          "note": "Ridge-to-final ablation selected layer 17 by validation, reached only 3.71% test top-1 and 11.52% top-5 — below the final-subtoken majority baseline of 12.50%, indicating the 896-dim ridge translator fails with 10 training examples per word."
        },
        {
          "type": "artifact",
          "path": "results/summary.json",
          "itemId": null,
          "note": "layerwise_itl_vs_raw_tests shows ridge method is the weakest whole-word method across all layers; its validation top-1 at layer 17 was 6.25% per REPORT.md main table."
        }
      ],
      "updated_at": "2026-06-29T05:08:57.883559",
      "type": "hypothesis",
      "ts": "2026-06-29T05:08:57.883559",
      "links": []
    },
    {
      "id": "H3",
      "statement": "The implicit-token lens predicts held-out whole-word identities better than baselines based only on explicit final-subtoken identity or mean subtoken embeddings.",
      "status": "supported",
      "affects": [],
      "basedOn": [
        "planning.md"
      ],
      "evidence": [
        {
          "type": "artifact",
          "path": "results/summary.json",
          "itemId": null,
          "note": "ITL layer 5 test top-1 0.1953125 vs final-subtoken majority 0.125: accuracy_difference_itl_minus_baseline=0.0703125, difference_bootstrap_ci95=[0.02534, 0.11719], paired_randomization_p_value=0.00450, mcnemar_exact p=0.00464."
        },
        {
          "type": "artifact",
          "path": "results/additional_comparisons.json",
          "itemId": null,
          "note": "itl_layer5_vs_mean_subtoken_layer0: accuracy_difference=0.0859375, diff_ci95=[0.05078125, 0.12109375], paired_randomization_p=9.999e-05. itl_layer5_vs_raw_final_layer22: accuracy_difference=0.0546875, diff_ci95=[0.021484375, 0.087890625], p=0.0023."
        }
      ],
      "updated_at": "2026-06-29T05:08:57.883559",
      "type": "hypothesis",
      "ts": "2026-06-29T05:08:57.883559",
      "links": []
    },
    {
      "id": "H4",
      "statement": "Decoding accuracy varies systematically by layer, with middle/late layers outperforming very early layers for the implicit-token lens.",
      "status": "uncertain",
      "affects": [],
      "basedOn": [
        "planning.md"
      ],
      "evidence": [
        {
          "type": "artifact",
          "path": "results/summary.json",
          "itemId": null,
          "note": "layerwise_itl_vs_raw_tests: ITL advantage over raw prototype is largest at layers 1–6 (diffs 0.156–0.180) and shrinks by layer 22 (diff=0.021, BH-corrected p=0.175, ns). Systematic variation confirmed; however ITL peaks at layer 5, not middle/late as predicted."
        },
        {
          "type": "artifact",
          "path": "figures/layer_top1_accuracy.png",
          "itemId": null,
          "note": "Layer-wise plot shows ITL top-1 peaks at layer 5 (early), then declines; raw-final-prototype peaks at layer 22 — partial support for layerwise variation but direction differs from hypothesis."
        },
        {
          "type": "artifact",
          "path": "REPORT.md",
          "itemId": null,
          "note": "Report notes explicit final-subtoken diagnostic is strongest at layer 0 (20.12%), falling as ITL rises — qualitatively consistent with token erasure but ITL peak at layer 5 is earlier than 'middle/late' prediction."
        }
      ],
      "updated_at": "2026-06-29T05:08:57.883559",